{
  "$schema": "../schemas/domain-catalog.schema.json",
  "catalog_version": "0.2.0",
  "status": "research_inventory",
  "exhaustive": false,
  "jurisdiction": "US-FED",
  "families": [
    {
      "id": "household",
      "label": "Household and filing status",
      "concepts": [
        {
          "id": "household.filing_status",
          "label": "Filing status",
          "status": "inventoried",
          "rule_kinds": [
            "definition",
            "eligibility",
            "calculation"
          ]
        },
        {
          "id": "household.dependents",
          "label": "Dependents",
          "status": "inventoried",
          "rule_kinds": [
            "definition",
            "eligibility",
            "calculation"
          ]
        },
        {
          "id": "household.qualifying_child",
          "label": "Qualifying child",
          "status": "inventoried",
          "rule_kinds": [
            "definition",
            "eligibility",
            "calculation"
          ]
        },
        {
          "id": "household.qualifying_relative",
          "label": "Qualifying relative",
          "status": "inventoried",
          "rule_kinds": [
            "definition",
            "eligibility",
            "calculation"
          ]
        },
        {
          "id": "household.age_and_blindness",
          "label": "Age and blindness",
          "status": "inventoried",
          "rule_kinds": [
            "definition",
            "eligibility",
            "calculation"
          ]
        },
        {
          "id": "household.joint_return",
          "label": "Joint return",
          "status": "inventoried",
          "rule_kinds": [
            "definition",
            "eligibility",
            "calculation"
          ]
        },
        {
          "id": "household.community_property",
          "label": "Community property",
          "status": "inventoried",
          "rule_kinds": [
            "definition",
            "eligibility",
            "calculation"
          ]
        }
      ]
    },
    {
      "id": "residency",
      "label": "Residency and tax periods",
      "concepts": [
        {
          "id": "residency.resident_status",
          "label": "Resident status",
          "status": "inventoried",
          "rule_kinds": [
            "definition",
            "eligibility",
            "calculation"
          ]
        },
        {
          "id": "residency.dual_status",
          "label": "Dual status",
          "status": "inventoried",
          "rule_kinds": [
            "definition",
            "eligibility",
            "calculation"
          ]
        },
        {
          "id": "residency.tax_year",
          "label": "Tax year",
          "status": "inventoried",
          "rule_kinds": [
            "definition",
            "eligibility",
            "calculation"
          ]
        },
        {
          "id": "residency.partial_year",
          "label": "Partial year",
          "status": "inventoried",
          "rule_kinds": [
            "definition",
            "eligibility",
            "calculation"
          ]
        },
        {
          "id": "residency.territories",
          "label": "Territories",
          "status": "inventoried",
          "rule_kinds": [
            "definition",
            "eligibility",
            "calculation"
          ]
        }
      ]
    },
    {
      "id": "income",
      "label": "Income classifications",
      "concepts": [
        {
          "id": "income.wages",
          "label": "Wages",
          "status": "inventoried",
          "rule_kinds": [
            "definition",
            "eligibility",
            "calculation"
          ]
        },
        {
          "id": "income.taxable_interest",
          "label": "Taxable interest",
          "status": "inventoried",
          "rule_kinds": [
            "definition",
            "eligibility",
            "calculation"
          ]
        },
        {
          "id": "income.tax_exempt_interest",
          "label": "Tax exempt interest",
          "status": "inventoried",
          "rule_kinds": [
            "definition",
            "eligibility",
            "calculation"
          ]
        },
        {
          "id": "income.ordinary_dividends",
          "label": "Ordinary dividends",
          "status": "inventoried",
          "rule_kinds": [
            "definition",
            "eligibility",
            "calculation"
          ]
        },
        {
          "id": "income.qualified_dividends",
          "label": "Qualified dividends",
          "status": "inventoried",
          "rule_kinds": [
            "definition",
            "eligibility",
            "calculation"
          ]
        },
        {
          "id": "income.capital_gain_distributions",
          "label": "Capital gain distributions",
          "status": "inventoried",
          "rule_kinds": [
            "definition",
            "eligibility",
            "calculation"
          ]
        },
        {
          "id": "income.other_income",
          "label": "Other income",
          "status": "inventoried",
          "rule_kinds": [
            "definition",
            "eligibility",
            "calculation"
          ]
        },
        {
          "id": "income.excluded_income",
          "label": "Excluded income",
          "status": "inventoried",
          "rule_kinds": [
            "definition",
            "eligibility",
            "calculation"
          ]
        }
      ]
    },
    {
      "id": "employment",
      "label": "Employment and benefits",
      "concepts": [
        {
          "id": "employment.tips",
          "label": "Tips",
          "status": "inventoried",
          "rule_kinds": [
            "definition",
            "eligibility",
            "calculation"
          ]
        },
        {
          "id": "employment.overtime",
          "label": "Overtime",
          "status": "inventoried",
          "rule_kinds": [
            "definition",
            "eligibility",
            "calculation"
          ]
        },
        {
          "id": "employment.fringe_benefits",
          "label": "Fringe benefits",
          "status": "inventoried",
          "rule_kinds": [
            "definition",
            "eligibility",
            "calculation"
          ]
        },
        {
          "id": "employment.dependent_care_benefits",
          "label": "Dependent care benefits",
          "status": "inventoried",
          "rule_kinds": [
            "definition",
            "eligibility",
            "calculation"
          ]
        },
        {
          "id": "employment.adoption_benefits",
          "label": "Adoption benefits",
          "status": "inventoried",
          "rule_kinds": [
            "definition",
            "eligibility",
            "calculation"
          ]
        },
        {
          "id": "employment.statutory_employees",
          "label": "Statutory employees",
          "status": "inventoried",
          "rule_kinds": [
            "definition",
            "eligibility",
            "calculation"
          ]
        },
        {
          "id": "employment.multiple_employers",
          "label": "Multiple employers",
          "status": "inventoried",
          "rule_kinds": [
            "definition",
            "eligibility",
            "calculation"
          ]
        }
      ]
    },
    {
      "id": "investments",
      "label": "Investment transactions",
      "concepts": [
        {
          "id": "investments.capital_gains_losses",
          "label": "Capital gains losses",
          "status": "inventoried",
          "rule_kinds": [
            "definition",
            "eligibility",
            "calculation"
          ]
        },
        {
          "id": "investments.basis",
          "label": "Basis",
          "status": "inventoried",
          "rule_kinds": [
            "definition",
            "eligibility",
            "calculation"
          ]
        },
        {
          "id": "investments.holding_period",
          "label": "Holding period",
          "status": "inventoried",
          "rule_kinds": [
            "definition",
            "eligibility",
            "calculation"
          ]
        },
        {
          "id": "investments.wash_sales",
          "label": "Wash sales",
          "status": "inventoried",
          "rule_kinds": [
            "definition",
            "eligibility",
            "calculation"
          ]
        },
        {
          "id": "investments.bond_premium",
          "label": "Bond premium",
          "status": "inventoried",
          "rule_kinds": [
            "definition",
            "eligibility",
            "calculation"
          ]
        },
        {
          "id": "investments.market_discount",
          "label": "Market discount",
          "status": "inventoried",
          "rule_kinds": [
            "definition",
            "eligibility",
            "calculation"
          ]
        },
        {
          "id": "investments.original_issue_discount",
          "label": "Original issue discount",
          "status": "inventoried",
          "rule_kinds": [
            "definition",
            "eligibility",
            "calculation"
          ]
        },
        {
          "id": "investments.nondividend_distributions",
          "label": "Nondividend distributions",
          "status": "inventoried",
          "rule_kinds": [
            "definition",
            "eligibility",
            "calculation"
          ]
        },
        {
          "id": "investments.special_gains",
          "label": "Special gains",
          "status": "inventoried",
          "rule_kinds": [
            "definition",
            "eligibility",
            "calculation"
          ]
        },
        {
          "id": "investments.digital_assets",